{
  "$schema": "http://json-schema.org/draft-04/schema#",
  "type": "object",
  "properties": {
    "_id": {
      "type": "string"
    },
    "group": {
      "$ref": "readmeGroup.json#"
    },
    "clientIPAddress": {
      "type": "string"
    },
    "development": {
      "type": "boolean"
    },
    "request": {
      "$ref": "har.json#"
    }
  },
  "required": ["group", "clientIPAddress", "development", "request"]
}
